{
  "schema_version": 1,
  "summary_id": "22222222-2222-4222-8222-000000000025",
  "flight_id": "22222222-2222-4222-8222-000000000004",
  "edge_boot_id": "22222222-2222-4222-8222-000000000005",
  "session_id": "22222222-2222-4222-8222-000000000021",
  "started_at_edge_monotonic_ns": 12883000000,
  "ended_at_edge_monotonic_ns": 12901000000,
  "ai_uptime_ratio": 0.96,
  "covered_frames": 27000,
  "skipped_frames": 430,
  "gaps": [
    {
      "kind": "AI_GAP",
      "start_ms": 400000,
      "duration_ms": 2500,
      "reason": "edge_model_restarting"
    }
  ],
  "min_verified_person_equipment_distance_m": null,
  "person_count_max": 3,
  "equipment_count_max": 1,
  "quality_reasons": [
    "UNVERIFIED_FRAME_CAPTURE_TIME"
  ],
  "created_at_edge_monotonic_ns": 12901005000
}
